{
  "classifier_version": "1",
  "content_hash": "bdbcc55177541d0b05b9603dfdc18054f73d86063807f933cf3fd4defb46ef9e",
  "edges": [
    {
      "id": "edge:authored:0bf801fb4e749cde",
      "kind": "authored",
      "label": null,
      "source": "committer:b0f029c27377",
      "target": "branch:borealis:develop"
    },
    {
      "id": "edge:authored:124ed54fcc5cdbb7",
      "kind": "authored",
      "label": null,
      "source": "committer:3ca93ad87e0b",
      "target": "branch:borealis:develop"
    },
    {
      "id": "edge:authored:46136c1c800684e3",
      "kind": "authored",
      "label": null,
      "source": "committer:b0f029c27377",
      "target": "branch:aurora:main"
    },
    {
      "id": "edge:authored:8c77cfcd282cfc92",
      "kind": "authored",
      "label": null,
      "source": "committer:a460e37bf4d8",
      "target": "branch:aurora:main"
    },
    {
      "id": "edge:authored:d6e035967238d266",
      "kind": "authored",
      "label": null,
      "source": "committer:a460e37bf4d8",
      "target": "branch:borealis:develop"
    },
    {
      "id": "edge:authored:f244b180ac7a30e6",
      "kind": "authored",
      "label": null,
      "source": "committer:3ca93ad87e0b",
      "target": "branch:aurora:main"
    },
    {
      "id": "edge:branch_of:57806a81c5008cb8",
      "kind": "branch_of",
      "label": null,
      "source": "branch:borealis:develop",
      "target": "repo:borealis"
    },
    {
      "id": "edge:branch_of:86c24c39a9a504bc",
      "kind": "branch_of",
      "label": null,
      "source": "branch:aurora:main",
      "target": "repo:aurora"
    }
  ],
  "layout_version": "1",
  "nodes": [
    {
      "id": "branch:aurora:main",
      "kind": "branch",
      "label": "main",
      "parent": "repo:aurora",
      "x": 1.4083438190194563e-14,
      "y": -325.0
    },
    {
      "id": "branch:borealis:develop",
      "kind": "branch",
      "label": "develop",
      "parent": "repo:borealis",
      "x": 1.4083438190194563e-14,
      "y": 135.0
    },
    {
      "id": "committer:3ca93ad87e0b",
      "kind": "committer",
      "label": "Ada Lovelace",
      "parent": null,
      "x": 2.87791997799628e-14,
      "y": -470.0
    },
    {
      "id": "committer:a460e37bf4d8",
      "kind": "committer",
      "label": "Bob Bits",
      "parent": null,
      "x": 407.0319397786862,
      "y": 234.99999999999991
    },
    {
      "id": "committer:b0f029c27377",
      "kind": "committer",
      "label": "Carol Compiler",
      "parent": null,
      "x": -407.0319397786861,
      "y": 235.00000000000017
    },
    {
      "id": "repo:aurora",
      "kind": "repo",
      "label": "aurora",
      "parent": null,
      "x": 1.4083438190194563e-14,
      "y": -230.0
    },
    {
      "id": "repo:borealis",
      "kind": "repo",
      "label": "borealis",
      "parent": null,
      "x": 1.4083438190194563e-14,
      "y": 230.0
    }
  ],
  "palette": {
    "assets": "#c3e88d",
    "build": "#ff8fa3",
    "code": "#4fd1ff",
    "config": "#c792ea",
    "data": "#82aaff",
    "deps": "#f78c6c",
    "docs": "#ffd166",
    "other": "#9fb0c0",
    "tests": "#7cffb2"
  },
  "palette_version": "1",
  "pulses": [
    {
      "branch": "branch:aurora:main",
      "color": "#4fd1ff",
      "deletions": 95,
      "files_changed": 2,
      "id": "pulse:aurora:4ef9149d4954",
      "insertions": 283,
      "intensity": 0.8118,
      "kind": "code",
      "kinds": [
        {
          "files": 1,
          "kind": "code"
        },
        {
          "files": 1,
          "kind": "data"
        }
      ],
      "node": "branch:aurora:main",
      "path": [
        "committer:a460e37bf4d8",
        "branch:aurora:main",
        "repo:aurora"
      ],
      "ref": "4ef9149d4954",
      "repo": "repo:aurora",
      "source": "Bob Bits",
      "source_id": "committer:a460e37bf4d8",
      "t": 1716081029,
      "title": "test: cover metrics"
    },
    {
      "branch": "branch:borealis:develop",
      "color": "#4fd1ff",
      "deletions": 104,
      "files_changed": 3,
      "id": "pulse:borealis:d67444ec4b9b",
      "insertions": 197,
      "intensity": 0.7808,
      "kind": "code",
      "kinds": [
        {
          "files": 2,
          "kind": "code"
        },
        {
          "files": 1,
          "kind": "tests"
        }
      ],
      "node": "branch:borealis:develop",
      "path": [
        "committer:b0f029c27377",
        "branch:borealis:develop",
        "repo:borealis"
      ],
      "ref": "d67444ec4b9b",
      "repo": "repo:borealis",
      "source": "Carol Compiler",
      "source_id": "committer:b0f029c27377",
      "t": 1716142974,
      "title": "chore: bump loader"
    },
    {
      "branch": "branch:aurora:main",
      "color": "#4fd1ff",
      "deletions": 27,
      "files_changed": 2,
      "id": "pulse:aurora:e06ecbe830d1",
      "insertions": 66,
      "intensity": 0.6212,
      "kind": "code",
      "kinds": [
        {
          "files": 1,
          "kind": "code"
        },
        {
          "files": 1,
          "kind": "build"
        }
      ],
      "node": "branch:aurora:main",
      "path": [
        "committer:a460e37bf4d8",
        "branch:aurora:main",
        "repo:aurora"
      ],
      "ref": "e06ecbe830d1",
      "repo": "repo:aurora",
      "source": "Bob Bits",
      "source_id": "committer:a460e37bf4d8",
      "t": 1716221414,
      "title": "test: cover export"
    },
    {
      "branch": "branch:borealis:develop",
      "color": "#4fd1ff",
      "deletions": 22,
      "files_changed": 2,
      "id": "pulse:borealis:b2cd46346876",
      "insertions": 55,
      "intensity": 0.5957,
      "kind": "code",
      "kinds": [
        {
          "files": 1,
          "kind": "code"
        },
        {
          "files": 1,
          "kind": "tests"
        }
      ],
      "node": "branch:borealis:develop",
      "path": [
        "committer:3ca93ad87e0b",
        "branch:borealis:develop",
        "repo:borealis"
      ],
      "ref": "b2cd46346876",
      "repo": "repo:borealis",
      "source": "Ada Lovelace",
      "source_id": "committer:3ca93ad87e0b",
      "t": 1716275352,
      "title": "refactor: simplify cache"
    },
    {
      "branch": "branch:borealis:develop",
      "color": "#4fd1ff",
      "deletions": 84,
      "files_changed": 4,
      "id": "pulse:borealis:c99bd3268885",
      "insertions": 145,
      "intensity": 0.7435,
      "kind": "code",
      "kinds": [
        {
          "files": 2,
          "kind": "code"
        },
        {
          "files": 2,
          "kind": "build"
        }
      ],
      "node": "branch:borealis:develop",
      "path": [
        "committer:b0f029c27377",
        "branch:borealis:develop",
        "repo:borealis"
      ],
      "ref": "c99bd3268885",
      "repo": "repo:borealis",
      "source": "Carol Compiler",
      "source_id": "committer:b0f029c27377",
      "t": 1716350681,
      "title": "feat: auth"
    },
    {
      "branch": "branch:aurora:main",
      "color": "#82aaff",
      "deletions": 109,
      "files_changed": 1,
      "id": "pulse:aurora:ffe8f30e97c7",
      "insertions": 86,
      "intensity": 0.7217,
      "kind": "data",
      "kinds": [
        {
          "files": 1,
          "kind": "data"
        }
      ],
      "node": "branch:aurora:main",
      "path": [
        "committer:3ca93ad87e0b",
        "branch:aurora:main",
        "repo:aurora"
      ],
      "ref": "ffe8f30e97c7",
      "repo": "repo:aurora",
      "source": "Ada Lovelace",
      "source_id": "committer:3ca93ad87e0b",
      "t": 1716433331,
      "title": "feat: graph"
    },
    {
      "branch": "branch:borealis:develop",
      "color": "#4fd1ff",
      "deletions": 35,
      "files_changed": 2,
      "id": "pulse:borealis:f1ce5c393d32",
      "insertions": 48,
      "intensity": 0.6058,
      "kind": "code",
      "kinds": [
        {
          "files": 1,
          "kind": "code"
        },
        {
          "files": 1,
          "kind": "build"
        }
      ],
      "node": "branch:borealis:develop",
      "path": [
        "committer:3ca93ad87e0b",
        "branch:borealis:develop",
        "repo:borealis"
      ],
      "ref": "f1ce5c393d32",
      "repo": "repo:borealis",
      "source": "Ada Lovelace",
      "source_id": "committer:3ca93ad87e0b",
      "t": 1716528740,
      "title": "docs: explain parser"
    },
    {
      "branch": "branch:borealis:develop",
      "color": "#7cffb2",
      "deletions": 36,
      "files_changed": 4,
      "id": "pulse:borealis:f186d61fefa9",
      "insertions": 176,
      "intensity": 0.733,
      "kind": "tests",
      "kinds": [
        {
          "files": 1,
          "kind": "code"
        },
        {
          "files": 2,
          "kind": "tests"
        },
        {
          "files": 1,
          "kind": "assets"
        }
      ],
      "node": "branch:borealis:develop",
      "path": [
        "committer:a460e37bf4d8",
        "branch:borealis:develop",
        "repo:borealis"
      ],
      "ref": "f186d61fefa9",
      "repo": "repo:borealis",
      "source": "Bob Bits",
      "source_id": "committer:a460e37bf4d8",
      "t": 1716602290,
      "title": "fix: handle parser edge case"
    },
    {
      "branch": "branch:aurora:main",
      "color": "#4fd1ff",
      "deletions": 15,
      "files_changed": 2,
      "id": "pulse:aurora:b3fbae81ee1b",
      "insertions": 82,
      "intensity": 0.6269,
      "kind": "code",
      "kinds": [
        {
          "files": 1,
          "kind": "code"
        },
        {
          "files": 1,
          "kind": "docs"
        }
      ],
      "node": "branch:aurora:main",
      "path": [
        "committer:3ca93ad87e0b",
        "branch:aurora:main",
        "repo:aurora"
      ],
      "ref": "b3fbae81ee1b",
      "repo": "repo:aurora",
      "source": "Ada Lovelace",
      "source_id": "committer:3ca93ad87e0b",
      "t": 1716628167,
      "title": "feat: loader"
    },
    {